Database,Table,Rows,Columns,Column Names
ship_mission,mission,7,7,"Mission_ID, Ship_ID, Code, Launched_Year, Location, Speed_knots, Fate"
ship_mission,ship,8,5,"Ship_ID, Name, Type, Nationality, Tonnage"
student_assessment,Addresses,15,7,"address_id, line_1, line_2, city, zip_postcode, state_province_county, country"
student_assessment,People,8,8,"person_id, first_name, middle_name, last_name, cell_mobile_number, email_address, login_name, password"
student_assessment,Students,8,2,"student_id, student_details"
student_assessment,Courses,6,4,"course_id, course_name, course_description, other_details"
student_assessment,People_Addresses,8,5,"person_address_id, person_id, address_id, date_from, date_to"
student_assessment,Student_Course_Registrations,9,3,"student_id, course_id, registration_date"
student_assessment,Student_Course_Attendance,8,3,"student_id, course_id, date_of_attendance"
student_assessment,Candidates,8,2,"candidate_id, candidate_details"
student_assessment,Candidate_Assessments,5,4,"candidate_id, qualification, assessment_date, asessment_outcome_code"
assets_maintenance,Third_Party_Companies,15,5,"company_id, company_type, company_name, company_address, other_company_details"
assets_maintenance,Maintenance_Contracts,15,5,"maintenance_contract_id, maintenance_contract_company_id, contract_start_date, contract_end_date, other_contract_details"
assets_maintenance,Parts,3,5,"part_id, part_name, chargeable_yn, chargeable_amount, other_part_details"
assets_maintenance,Skills,3,3,"skill_id, skill_code, skill_description"
assets_maintenance,Staff,15,4,"staff_id, staff_name, gender, other_staff_details"
assets_maintenance,Assets,15,9,"asset_id, maintenance_contract_id, supplier_company_id, asset_details, asset_make, asset_model, asset_acquired_date, asset_disposed_date, other_asset_details"
assets_maintenance,Asset_Parts,15,2,"asset_id, part_id"
assets_maintenance,Maintenance_Engineers,15,5,"engineer_id, company_id, first_name, last_name, other_details"
assets_maintenance,Engineer_Skills,20,2,"engineer_id, skill_id"
assets_maintenance,Fault_Log,15,6,"fault_log_entry_id, asset_id, recorded_by_staff_id, fault_log_entry_datetime, fault_description, other_fault_details"
assets_maintenance,Engineer_Visits,15,8,"engineer_visit_id, contact_staff_id, engineer_id, fault_log_entry_id, fault_status, visit_start_datetime, visit_end_datetime, other_visit_details"
assets_maintenance,Part_Faults,15,5,"part_fault_id, part_id, fault_short_name, fault_description, other_fault_details"
assets_maintenance,Fault_Log_Parts,15,3,"fault_log_entry_id, part_fault_id, fault_status"
assets_maintenance,Skills_Required_To_Fix,15,2,"part_fault_id, skill_id"
twitter_1,follows,9,2,"f1, f2"
twitter_1,tweets,8,4,"id, uid, text, createdate"
twitter_1,user_profiles,7,5,"uid, name, email, partitionid, followers"
body_builder,body_builder,5,5,"Body_Builder_ID, People_ID, Snatch, Clean_Jerk, Total"
body_builder,people,6,6,"People_ID, Name, Height, Weight, Birth_Date, Birth_Place"
school_player,school,6,10,"School_ID, School, Location, Enrollment, Founded, Denomination, Boys_or_Girls, Day_or_Boarding, Year_Entered_Competition, School_Colors"
school_player,school_details,6,6,"School_ID, Nickname, Colors, League, Class, Division"
school_player,school_performance,22,4,"School_Id, School_Year, Class_A, Class_AA"
school_player,player,23,6,"Player_ID, Player, Team, Age, Position, School_ID"
